### ISSUE TITLE
Sflow Agent ID reconfiguration is not working upon deleting the agentID

### ISSUE THREAD

**Issue by vidhya-rajan** [sonic-net/sonic-buildimage#13108]
#### Description
config sflow agent-id add <interfaceName> 
Upon configuring a valid agent ID,  the sample packet contains the IP address corresponding to the interface. 
Once the agentID is removed using config sflow agent-id del, agentID should fallback to the default IP (multicast IP ) 

Issue observed is the older agentID still persists in the sample packet and the previous agentID is not unconfigured.

#### Steps to reproduce the issue:
1. Load 202205 community SONiC release build
2. Enable sflow feature by using 'config feature state sflow enabled '
3. Ensure sflow docker is instantiated successfully before executing sflow rleated config commands.
4. Enable sflow globally by using 'config sflow enable'
5. Configure a valid agenID using the command config sflow agent-id add <interfaceName> 
6. Remove the configured agent-id using config sflow agent-id del

#### Describe the results you received:
Sample packet contains the previously configured agentID though the agentID id deleted

03:03:55.524563 IP 6.1.1.2.55682 > 6.1.1.1.6343: sFlowv5, **IPv4 agent 3.3.3.1**, agent-id 100000, length 1288
03:03:55.526175 IP 6.1.1.2.55682 > 6.1.1.1.6343: sFlowv5, IPv4 agent 3.3.3.1, agent-id 100000, length 448
#### Describe the results you expected:
The sample packet should contain the multicast IP as agentID since the previously configured agentID is deleted. 

03:04:01.535556 IP 6.1.1.2.56719 > 6.1.1.1.6343: sFlowv5, **IPv4 agent 240.127.1.1**, agent-id 100000, length 868

#### Root cause

Two reasons for the failure
1. Application DB persists the previously configured agentID even after reconfiguration.
2. Hsflow daemon sends event notifications for every configuration change. The agentID event notification is sent only for addition of agentID and not removal 

#### Proposed Solution

1. Application DB has to remove the agenID upon deletion.
2. Hsflow daemon has to send agentID config notifications for removal.

**Comment by vidhya-rajan** [comment]
Please check if we can raise a PR for the below patch in hsflow 

`diff --git a/src/Linux/mod_sonic.c b/src/Linux/mod_sonic.c
index b109537..f722107 100644
--- a/src/Linux/mod_sonic.c
+++ b/src/Linux/mod_sonic.c
@@ -1576,6 +1576,9 @@ extern "C" {
       if(mdata->sflow_agent) {
 	snprintf(cfgLine, EV_MAX_EVT_DATALEN, "agent=%s", mdata->sflow_agent);
 	EVEventTx(mod, mdata->configEvent, cfgLine, my_strlen(cfgLine));
+      } else {
+	snprintf(cfgLine, EV_MAX_EVT_DATALEN, "agent=%s", "");
+	EVEventTx(mod, mdata->configEvent, cfgLine, my_strlen(cfgLine));
       }
       snprintf(cfgLine, EV_MAX_EVT_DATALEN, "polling=%u", mdata->sflow_polling);
       EVEventTx(mod, mdata->configEvent, cfgLine, my_strlen(cfgLine));
`

**Comment by vidhya-rajan** [comment]
[0003-host_sflow_sonic.patch](https://github.com/sonic-net/sonic-buildimage/files/10258163/0003-host_sflow_sonic.patch)
Please find the attached patch with fix in hsflow

**Comment by vadymhlushko-mlnx** [comment]
> [0003-host_sflow_sonic.patch](https://github.com/sonic-net/sonic-buildimage/files/10258163/0003-host_sflow_sonic.patch) @dgsudharsan @venkatmahalingam @liat-grozovik @hari-selvam Please find the attached patch with fix in hsflow . Kindly let us know if we could add this patch in sonic sflow

LGTM!

**Comment by dgsudharsan** [comment]
@vidhya-rajan The change looks good to me. Please raise an issue or fix in hsflowd and once its approved there we can raise patch fix in SONiC.
Regarding application DB, the field is not used there. hsflowd obtains this filed from config_db. You can remove it in appl db if required.

**Comment by vidhya-rajan** [comment]
> @vidhya-rajan The change looks good to me. Please raise an issue or fix in hsflowd and once its approved there we can raise patch fix in SONiC. Regarding application DB, the field is not used there. hsflowd obtains this filed from config_db. You can remove it in appl db if required.

Thanks @dgsudharsan . Will raise a PR for the fix.

**Comment by vidhya-rajan** [comment]
host-sflow have added commits recently to address dynamic config change along with the above mentioned issue 

https://github.com/sflow/host-sflow/commit/7cb2b83ef34ed970a7b6028e8b3d4b44ddef8452
This requires upgrade of host-sflow in community SONIC
