### ISSUE TITLE
[EVPN]ARP request is not generated for the unresolved local hosts for traffic from remote

### ISSUE THREAD

**Issue by dgsudharsan** [sonic-net/sonic-buildimage#14882]
#### Description

When a traffic is sent to unresolved host from remote VTEP, the local VTEP doesn't try resolving the ARP. This is due to the fact that the Vxlan interface and the VLAN don't belong to same VRF in the Linux kernel. Eventhough we create VRF - VNI map, VLAN VNI map as well as VRF VLAN mapping in SONiC , there is not mapping added between VRF to the Vxlan interface created in linux. Hence the linux kernel couldn't generate ARP request.

#### Steps to reproduce the issue:
1. Configure L3 EVPN
2. Ensure no ARP is resolved locally
3. Send traffic from remote

#### Describe the results you received:
No ARP resolution is tried by SONiC

```
root@qa-eth-vt03-3-4600ca1:~# sonic-clear arp
2.2.2.2 dev Vlan10 lladdr b8:59:9f:a8:e2:00 extern_learn  used 40/40/40 probes 0 NOARP proto zebra
1.11.0.3 dev Vlan11 lladdr 00:11:01:00:00:02 used 38/3638/38 probes 0 STALE
1.11.0.2 dev Vlan11 lladdr 00:11:01:00:00:01 used 38/3638/38 probes 0 STALE
1.11.0.11 dev Vlan11 lladdr 00:11:01:00:00:0a used 38/3638/38 probes 0 STALE
10.209.20.1 dev eth0 lladdr 00:00:5e:00:01:01 ref 1 used 17/0/16 probes 1 REACHABLE
1.11.0.10 dev Vlan11 lladdr 00:11:01:00:00:09 used 38/3638/38 probes 0 STALE
1.11.0.9 dev Vlan11 lladdr 00:11:01:00:00:08 used 38/3638/38 probes 0 STALE
1.11.0.7 dev Vlan11 lladdr 00:11:01:00:00:06 used 38/3638/38 probes 0 STALE
1.11.0.8 dev Vlan11 lladdr 00:11:01:00:00:07 used 38/3638/38 probes 0 STALE
1.11.0.6 dev Vlan11 lladdr 00:11:01:00:00:05 used 38/3638/38 probes 0 STALE
1.11.0.5 dev Vlan11 lladdr 00:11:01:00:00:04 used 38/3638/38 probes 0 STALE
1.0.0.2 dev Ethernet48 lladdr b8:59:9f:a8:e2:00 ref 1 used 41/40/41 probes 5 REACHABLE
1.11.0.4 dev Vlan11 lladdr 00:11:01:00:00:03 used 38/3638/38 probes 0 STALE

*** Round 1, deleting 13 entries ***
2.2.2.2 dev Vlan10 lladdr b8:59:9f:a8:e2:00 extern_learn  used 0/0/0 probes 0 NOARP proto zebra

*** Round 2, deleting 1 entries ***
*** Flush is complete after 2 rounds ***

root@qa-eth-vt03-3-4600ca1:~# ip link show master Vrf_A
9: Vlan11@Bridge: <BROADCAST,MULTICAST,UP,LOWER_UP> mtu 9100 qdisc noqueue master Vrf_A state UP mode DEFAULT group default qlen 1000
    link/ether 90:0a:84:0c:3e:00 brd ff:ff:ff:ff:ff:ff
root@qa-eth-vt03-3-4600ca1:~#

root@qa-eth-vt03-3-4600ca1:~# tcpdump -i VTEP1-10 -n
tcpdump: verbose output suppressed, use -v[v]... for full protocol decode
listening on VTEP1-10, link-type EN10MB (Ethernet), snapshot length 262144 bytes
03:32:27.949368 IP 1.12.0.3 > 1.11.0.3:  ip-proto-61 962
03:32:27.957364 IP 1.12.0.11 > 1.11.0.11:  ip-proto-61 962
03:32:27.958357 IP 1.12.0.2 > 1.11.0.2:  ip-proto-61 962
03:32:27.959356 IP 1.12.0.3 > 1.11.0.3:  ip-proto-61 962
03:32:27.960355 IP 1.12.0.4 > 1.11.0.4:  ip-proto-61 962
03:32:27.961372 IP 1.12.0.5 > 1.11.0.5:  ip-proto-61 962
03:32:27.962362 IP 1.12.0.6 > 1.11.0.6:  ip-proto-61 962
03:32:27.963356 IP 1.12.0.7 > 1.11.0.7:  ip-proto-61 962
03:32:27.974360 IP 1.12.0.8 > 1.11.0.8:  ip-proto-61 962
03:32:27.975356 IP 1.12.0.9 > 1.11.0.9:  ip-proto-61 962
03:32:27.976356 IP 1.12.0.10 > 1.11.0.10:  ip-proto-61 962
03:32:27.977355 IP 1.12.0.11 > 1.11.0.11:  ip-proto-61 962
03:32:27.982350 IP 1.12.0.6 > 1.11.0.6:  ip-proto-61 962
03:32:27.983350 IP 1.12.0.7 > 1.11.0.7:  ip-proto-61 962
03:32:27.984355 IP 1.12.0.8 > 1.11.0.8:  ip-proto-61 962
03:32:27.999358 IP 1.12.0.3 > 1.11.0.3:  ip-proto-61 962

```

#### Describe the results you expected:
ARP resolution should be tried by SONiC

#### Output of `show version`:

```
show version

SONiC Software Version: SONiC.202211_RC10.5-ccd364806_Internal
Distribution: Debian 11.6
Kernel: 5.10.0-18-2-amd64
Build commit: ccd364806
Build date: Tue Apr 25 11:25:50 UTC 2023
Built by: sw-r2d2-bot@r-build-sonic-ci03-244

Platform: x86_64-mlnx_msn4600c-r0
HwSKU: ACS-MSN4600C
ASIC: mellanox
ASIC Count: 1
Serial Number: MT2152X02375
Model Number: MSN4600-CS2FO_QP
Hardware Revision: A1
Uptime: 03:32:51 up 3 min,  1 user,  load average: 0.77, 0.63, 0.28
Date: Sat 29 Apr 2023 03:32:51

Docker images:
REPOSITORY                                         TAG                                IMAGE ID       SIZE
docker-platform-monitor                            202211_RC10.5-ccd364806_Internal   1e3131b74da8   875MB
docker-platform-monitor                            latest                             1e3131b74da8   875MB
docker-syncd-mlnx                                  202211_RC10.5-ccd364806_Internal   d6c5ab297b91   873MB
docker-syncd-mlnx                                  latest                             d6c5ab297b91   873MB
urm.nvidia.com/sw-nbu-sws-sonic-docker/sonic-wjh   1.4.0-202211-internal-17           2c36f5c368f2   323MB
docker-sonic-telemetry                             202211_RC10.5-ccd364806_Internal   e47f08b4aeef   736MB
docker-sonic-telemetry                             latest                             e47f08b4aeef   736MB
docker-orchagent                                   202211_RC10.5-ccd364806_Internal   b440c6ac5b7e   473MB
docker-orchagent                                   latest                             b440c6ac5b7e   473MB
docker-macsec                                      latest                             399c8fca02be   456MB
docker-snmp                                        202211_RC10.5-ccd364806_Internal   8d4f865340e9   483MB
docker-snmp                                        latest                             8d4f865340e9   483MB
docker-teamd                                       202211_RC10.5-ccd364806_Internal   70dd03f31edf   454MB
docker-teamd                                       latest                             70dd03f31edf   454MB
docker-dhcp-relay                                  latest                             cdb07043c14c   447MB
docker-sonic-p4rt                                  202211_RC10.5-ccd364806_Internal   b7898390d296   520MB
docker-sonic-p4rt                                  latest                             b7898390d296   520MB
docker-database                                    202211_RC10.5-ccd364806_Internal   f3e88196c6f2   438MB
docker-database                                    latest                             f3e88196c6f2   438MB
docker-lldp                                        202211_RC10.5-ccd364806_Internal   934898e43b37   480MB
docker-lldp                                        latest                             934898e43b37   480MB
docker-mux                                         202211_RC10.5-ccd364806_Internal   02c889d5def1   486MB
docker-mux                                         latest                             02c889d5def1   486MB
docker-router-advertiser                           202211_RC10.5-ccd364806_Internal   0c17fcb7002c   438MB
docker-router-advertiser                           latest                             0c17fcb7002c   438MB
docker-eventd                                      202211_RC10.5-ccd364806_Internal   ab5056368b0f   437MB
docker-eventd                                      latest                             ab5056368b0f   437MB
docker-sflow                                       202211_RC10.5-ccd364806_Internal   46c53f91bae8   421MB
docker-sflow                                       latest                             46c53f91bae8   421MB
docker-nat                                         202211_RC10.5-ccd364806_Internal   cd75bd3f135e   423MB
docker-nat                                         latest                             cd75bd3f135e   423MB
docker-sonic-mgmt-framework                        202211_RC10.5-ccd364806_Internal   0ff605611860   554MB
docker-sonic-mgmt-framework                        latest                             0ff605611860   554MB
docker-fpm-frr                                     202211_RC10.5-ccd364806_Internal   39f745abe830   490MB
docker-fpm-frr                                     latest                             39f745abe830   490MB
urm.nvidia.com/sw-nbu-sws-sonic-docker/doroce      1.1.0-202211-internal-3            2dc868815162   200MB

```
#### Output of `show techsupport`:

```
(paste your output here or download and attach the file here )
```

#### Additional information you deem important (e.g. issue happens only occasionally):

[sonic_dump_qa-eth-vt03-3-4600ca1_20230429_033313.tar.gz](https://github.com/sonic-net/sonic-buildimage/files/11357976/sonic_dump_qa-eth-vt03-3-4600ca1_20230429_033313.tar.gz)

**Comment by hasan-brcm** [comment]
Hello @dgsudharsan , can you please create vlan-vni mapping for tenant Vlan11. I don't see L2 VNI configured. Only L3VNI is present:
{code}
bgp.evpn.vni:

VNI: 770010
  Type: L3
  Tenant VRF: Vrf_A
  Local Vtep Ip: 1.1.1.1
  Vxlan-Intf: VTEP1-10
  SVI-If: Vlan10
  State: Up
  VNI Filter: none
  System MAC: 90:0a:84:0c:3e:00
  Router MAC: 90:0a:84:0c:3e:00
  L2 VNIs:
{code}

**Comment by Hedgehog-Guru** [comment]
Tried with L2 VNI mapping added on both switches. Didn't help.
Fresh sysdumps are attached

[sonic_dump_qa-eth-vt03-3-4600ca1_20230510_194926.tar.gz](https://github.com/sonic-net/sonic-buildimage/files/11444350/sonic_dump_qa-eth-vt03-3-4600ca1_20230510_194926.tar.gz)
[sonic_dump_qa-eth-vt03-4-3700v_20230510_194929.tar.gz](https://github.com/sonic-net/sonic-buildimage/files/11444351/sonic_dump_qa-eth-vt03-4-3700v_20230510_194929.tar.gz)

**Comment by hasan-brcm** [comment]
@Hedgehog-Guru, thanks for sharing the tech-support data from both of the switches.
This is how your topology looks like:
```
H1(1.11.0.3)  --  VT3-3 --(vxlan)-- VT3-4  --  H2(1.12.0.3)

Where H1 & H2 are hosts, and VT3-3 & VT3-4 are vteps.

VT3-3:
    Vlan11 has 1.11.0.0/24 subnet.
    Vlan12 is not stretched.
    Vlan10 is IRB vlan for L3VNI (Vrf_A)

VT3-4:
    Vlan12 has 1.12.0.0/24 subnet.
    Vlan11 is not stretched.
    Vlan10 is IRB vlan for L3VNI (Vrf_A)
```

In my previous post, I was under the impression that the tenant Vlan11 is stretched between the Vteps, and that's why I asked to configure Vlan-vni mapping. But that is not the case.

Just to re-iterate the problem:
  - ping is initiated from H2 to H1.
  - packets arrive on VT3-3 with dip=1.11.0.3 over L3VNI vxlan, but ARP for 1.11.0.3 is not triggered in the kernel.

The reason for VT3-3 not able to resolve ARP is because Vlan10 is not member of Vrf_A.
Please note that the IRB Vlan for the L3VNI should be part of the corresponding Vrf.

On VT3-3, only the Vlan11 is configured member of Vrf_A
```
  "VLAN_INTERFACE|Vlan11": {
    "expireat": 1683737396.1938248,
    "ttl": -0.001,
    "type": "hash",
    "value": {
      "vrf_name": "Vrf_A"   <<<
    }
  },
```
No vrf mapping exists for Vlan10.

**Comment by Hedgehog-Guru** [comment]
Yes, you are right. That was config issue. Thanks!
We can close this ticket

**Comment by dgsudharsan** [comment]
Thanks @Hedgehog-Guru . Will close this issue
