### ISSUE TITLE
Bug: L2 unicast (ARP reply/host-to-host) dropped between access ports in same VLAN on Dell Z9332F-ON

### ISSUE THREAD

**Issue by maxpain** [sonic-net/sonic-buildimage#24324]
### Is it platform specific

broadcom

### Importance or Severity

Critical

### Description of the bug

Two servers connected to access ports in the same VLAN can ping the SVI (Vlan interface) but cannot ping each other. Broadcast ARP requests from host A reach host B; host B sends an ARP unicast reply that never arrives at host A. On the switch, show arp contains both hosts, and the TX_DRP counter increases on the egress port that should forward the unicast ARP/ICMP to the peer.

Hardware: Dell Z9332F-ON

### Steps to Reproduce

1. Create VLAN and add two member interfaces as untagged access ports:
```
config vlan add 100
config vlan member add 100 Ethernet40 -u
config vlan member add 100 Ethernet56 -u
```

2. Configure an SVI on the VLAN:
```
config interface ip add Vlan100 10.0.0.254/24
```

3. Connect two servers:
	- Server A (on Ethernet40): 10.0.0.1/24
	- Server B (on Ethernet56): 10.0.0.3/24

4. Verify both servers can ping the SVI 10.0.0.254 ✔️
5. Attempt to ping between hosts (e.g., 10.0.0.3 -> 10.0.0.1) ❌
6. Observe ARP/tcpdump on both servers and counters on the switch.

### Actual Behavior and Expected Behavior

- Actual:
	- ping 10.0.0.1 from 10.0.0.3 fails.
	- Server B (10.0.0.3) repeatedly sends broadcast ARP requests and never sees the unicast ARP reply.
	- Server A (10.0.0.1) receives the ARP request and sends a unicast ARP reply.
	 On the switch, show arp has entries for both hosts; TX_DRP increases on the port that should forward the unicast reply/ICMP to the peer.

- Expected:
	- Unicast frames (including ARP replies and ICMP echo/replies) should be bridged between access ports in the same VLAN, and host-to-host ping should succeed.

### Relevant log output

```shell
Server 10.0.0.1 tcpdump (sees ARP request and sends reply):
13:04:51.619149 ARP, Request who-has 10.0.0.1 tell 10.0.0.3, length 46
13:04:51.619152 ARP, Reply 10.0.0.1 is-at 94:6d:ae:15:86:6c, length 28
13:04:52.643159 ARP, Request who-has 10.0.0.1 tell 10.0.0.3, length 46
13:04:52.643161 ARP, Reply 10.0.0.1 is-at 94:6d:ae:15:86:6c, length 28

Server 10.0.0.3 tcpdump (only broadcasts, never sees the unicast reply):
13:06:23.011227 ARP, Request who-has 10.0.0.1 tell 10.0.0.3, length 28
13:06:24.035233 ARP, Request who-has 10.0.0.1 tell 10.0.0.3, length 28
13:06:25.059218 ARP, Request who-has 10.0.0.1 tell 10.0.0.3, length 28
13:06:26.083227 ARP, Request who-has 10.0.0.1 tell 10.0.0.3, length 28

Switch show arp:
Address     MacAddress         Iface       Vlan
----------  -----------------  ----------  ------
10.0.0.1    94:6d:ae:15:86:6c  Ethernet56  100
10.0.0.3    b8:3f:d2:63:c2:54  Ethernet40  100
10.20.24.1  00:50:56:01:5c:a3  eth0        -
Total number of entries 3
```

### Output of `show version`, `show techsupport`

```shell
root@sonic:/home/admin# show version

SONiC Software Version: SONiC.master.966800-3843b7c23
SONiC OS Version: 12
Distribution: Debian 12.12
Kernel: 6.1.0-29-2-amd64
Build commit: 3843b7c23
Build date: Tue Oct 21 13:30:17 UTC 2025
Built by: azureuser@31881782c000000

Platform: x86_64-dellemc_z9332f_d1508-r0
HwSKU: DellEMC-Z9332f-O32
ASIC: broadcom
ASIC Count: 1
Serial Number: xxxxxxx
Model Number: 0J5HDG
Hardware Revision: A00
Uptime: 01:36:30 up 1 day, 10:13,  1 user,  load average: 1.69, 1.34, 1.13
Date: Thu 23 Oct 2025 01:36:30

Docker images:
REPOSITORY                    TAG                       IMAGE ID       SIZE
docker-gbsyncd-broncos        latest                    4eaa4b7d902f   322MB
docker-gbsyncd-broncos        master.966800-3843b7c23   4eaa4b7d902f   322MB
docker-gbsyncd-credo          latest                    a6342f1f5b21   296MB
docker-gbsyncd-credo          master.966800-3843b7c23   a6342f1f5b21   296MB
docker-telemetry-sidecar      latest                    8e748a2a91c9   269MB
docker-telemetry-sidecar      master.966800-3843b7c23   8e748a2a91c9   269MB
docker-syncd-brcm             latest                    c9a78dabac53   755MB
docker-syncd-brcm             master.966800-3843b7c23   c9a78dabac53   755MB
docker-telemetry-watchdog     latest                    25b31b9d81e5   386MB
docker-telemetry-watchdog     master.966800-3843b7c23   25b31b9d81e5   386MB
docker-fpm-frr                latest                    25ac6a90d8d6   351MB
docker-fpm-frr                master.966800-3843b7c23   25ac6a90d8d6   351MB
docker-dash-ha                latest                    223558a0d258   321MB
docker-dash-ha                master.966800-3843b7c23   223558a0d258   321MB
docker-dhcp-relay             latest                    b95c23e0347c   279MB
docker-dhcp-relay             master.966800-3843b7c23   b95c23e0347c   279MB
docker-sonic-bmp              latest                    777c636e6fc7   271MB
docker-sonic-bmp              master.966800-3843b7c23   777c636e6fc7   271MB
docker-macsec                 latest                    dfcc31142850   305MB
docker-macsec                 master.966800-3843b7c23   dfcc31142850   305MB
docker-teamd                  latest                    2e2fa62ad622   302MB
docker-teamd                  master.966800-3843b7c23   2e2fa62ad622   302MB
docker-platform-monitor       latest                    cb00cdf6b4d3   402MB
docker-platform-monitor       master.966800-3843b7c23   cb00cdf6b4d3   402MB
docker-snmp                   latest                    8a4480ee0035   294MB
docker-snmp                   master.966800-3843b7c23   8a4480ee0035   294MB
docker-sonic-mgmt-framework   latest                    28c82230c34b   363MB
docker-sonic-mgmt-framework   master.966800-3843b7c23   28c82230c34b   363MB
docker-sysmgr                 latest                    7a413fb65c30   281MB
docker-sysmgr                 master.966800-3843b7c23   7a413fb65c30   281MB
docker-sflow                  latest                    66e94a5f895d   303MB
docker-sflow                  master.966800-3843b7c23   66e94a5f895d   303MB
docker-orchagent              latest                    28b6ca804ef9   314MB
docker-orchagent              master.966800-3843b7c23   28b6ca804ef9   314MB
docker-router-advertiser      latest                    fa08bae1c43a   270MB
docker-router-advertiser      master.966800-3843b7c23   fa08bae1c43a   270MB
docker-nat                    latest                    a1d50cd22082   305MB
docker-nat                    master.966800-3843b7c23   a1d50cd22082   305MB
docker-gnmi-watchdog          latest                    d22677232015   276MB
docker-gnmi-watchdog          master.966800-3843b7c23   d22677232015   276MB
docker-mux                    latest                    86ff518a08ab   321MB
docker-mux                    master.966800-3843b7c23   86ff518a08ab   321MB
docker-lldp                   latest                    c91a0ea01a8b   315MB
docker-lldp                   master.966800-3843b7c23   c91a0ea01a8b   315MB
docker-sonic-gnmi             latest                    6d40c2e40d38   385MB
docker-sonic-gnmi             master.966800-3843b7c23   6d40c2e40d38   385MB
docker-eventd                 latest                    85f9f11eb3e4   269MB
docker-eventd                 master.966800-3843b7c23   85f9f11eb3e4   269MB
docker-auditd-watchdog        latest                    73f565428503   272MB
docker-auditd-watchdog        master.966800-3843b7c23   73f565428503   272MB
docker-bmp-watchdog           latest                    4838faf1f029   269MB
docker-bmp-watchdog           master.966800-3843b7c23   4838faf1f029   269MB
docker-database               latest                    4e762984e75e   276MB
docker-database               master.966800-3843b7c23   4e762984e75e   276MB
docker-auditd                 latest                    98687344b565   269MB
docker-auditd                 master.966800-3843b7c23   98687344b565   269MB
```

**Comment by maxpain** [comment]
```
show c cd5
PERQ_DROP_PKT_UC(0).cd5     :			  3		     +3
PERQ_DROP_BYTE_UC(0).cd5    :			306		   +306
drivshell>
show c cd7
RIPC4_64.cd7		    :			  3		     +3 	      1/s
RUC_64.cd7		    :			  3		     +3
RDBGC4_64.cd7		    :			  3		     +3 	      1/s
CDMIB_R127.cd7		    :			  3		     +3 	      1/s
CDMIB_RPRM.cd7		    :			  3		     +3 	      1/s
CDMIB_RPKT.cd7		    :			  3		     +3 	      1/s
CDMIB_RUCA.cd7		    :			  3		     +3
CDMIB_RPOK.cd7		    :			  3		     +3 	      1/s
CDMIB_RBYT.cd7		    :			306		   +306
CDMIB_RPROG2.cd7	    :			  3		     +3 	      1/s
drivshell>
```

I used `config qos reload` as a workaround.

https://netbergtw.com/top-support/articles/initial-sonic-configuration-on-innovium-based-aurora-switches/

> The reason you need to do “config qos reload” / “config save” is that SONiC auto-generated config_db.json on 1st init doesn’t include the qos/buffer settings from Innovium. Thus the chip’s datapath isn’t fully initialized. You need to do “config qos reload” / “config save” to generate the QoS/buffer settings from qos.json.j2 and buffers.json.j2 files.

**Comment by prabhataravind** [comment]
@maxpain could you confirm that `config qos reload` works as a solution?

**Comment by maxpain** [comment]
> [@maxpain](https://github.com/maxpain) could you confirm that `config qos reload` works as a solution?

yes, it helped me
